{
  "$schema": "../../../../../conversations/conversation-experience.schema.json",
  "id": "dk-lesson-91",
  "seriesId": "dk-conversations",
  "kind": "lesson",
  "number": 91,
  "title": "Using the internet",
  "summary": "学习询问网络连接、Wi-Fi 密码等实用表达。",
  "cover": "dk-office-workstation",
  "order": 91
}
