{
  "$schema": "../../../../../conversations/conversation-experience.schema.json",
  "id": "dk-lesson-88",
  "seriesId": "dk-conversations",
  "kind": "lesson",
  "number": 88,
  "title": "Media and communications",
  "summary": "学习谈论新闻来源和获取资讯的日常习惯。",
  "cover": "dk-office-workstation",
  "order": 88
}
