{
  "$schema": "../../../../../conversations/conversation-experience.schema.json",
  "id": "dk-lesson-94",
  "seriesId": "dk-conversations",
  "kind": "lesson",
  "number": 94,
  "title": "Messaging and video calls",
  "summary": "学习应对视频通话卡顿、断音和重复确认。",
  "cover": "dk-office-workstation",
  "order": 94
}
